{
  "commodity": {
    "desc": "SOYBEANS",
    "slug": "soybeans"
  },
  "county": {
    "code": "003",
    "name": "ALLEGHENY"
  },
  "rank": {
    "1983": {
      "count_in_nation": 1870,
      "count_in_state": 51,
      "percentile_in_nation": 0.6383,
      "percentile_in_state": 0.52,
      "rank_in_nation": 677,
      "rank_in_state": 25
    },
    "1984": {
      "count_in_nation": 1875,
      "count_in_state": 50,
      "percentile_in_nation": 0.6942,
      "percentile_in_state": 0.2245,
      "rank_in_nation": 574,
      "rank_in_state": 39
    },
    "1985": {
      "count_in_nation": 1853,
      "count_in_state": 51,
      "percentile_in_nation": 0.4579,
      "percentile_in_state": 0.16,
      "rank_in_nation": 1005,
      "rank_in_state": 43
    },
    "1986": {
      "count_in_nation": 1814,
      "count_in_state": 51,
      "percentile_in_nation": 0.5433,
      "percentile_in_state": 0.2,
      "rank_in_nation": 829,
      "rank_in_state": 41
    },
    "1987": {
      "count_in_nation": 1778,
      "count_in_state": 52,
      "percentile_in_nation": 0.6488,
      "percentile_in_state": 0.5098,
      "rank_in_nation": 625,
      "rank_in_state": 26
    },
    "1988": {
      "count_in_nation": 1814,
      "count_in_state": 52,
      "percentile_in_nation": 0.797,
      "percentile_in_state": 0.549,
      "rank_in_nation": 369,
      "rank_in_state": 24
    },
    "1989": {
      "count_in_nation": 1825,
      "count_in_state": 52,
      "percentile_in_nation": 0.5548,
      "percentile_in_state": 0.3333,
      "rank_in_nation": 813,
      "rank_in_state": 35
    },
    "1990": {
      "count_in_nation": 1773,
      "count_in_state": 52,
      "percentile_in_nation": 0.5581,
      "percentile_in_state": 0.1765,
      "rank_in_nation": 784,
      "rank_in_state": 43
    },
    "2002": {
      "count_in_nation": 1631,
      "count_in_state": 52,
      "percentile_in_nation": 0.1252,
      "percentile_in_state": 0.1373,
      "rank_in_nation": 1427,
      "rank_in_state": 45
    },
    "2003": {
      "count_in_nation": 1625,
      "count_in_state": 52,
      "percentile_in_nation": 0.8725,
      "percentile_in_state": 0.7255,
      "rank_in_nation": 208,
      "rank_in_state": 15
    },
    "2004": {
      "count_in_nation": 1678,
      "count_in_state": 51,
      "percentile_in_nation": 0.3924,
      "percentile_in_state": 0.16,
      "rank_in_nation": 1020,
      "rank_in_state": 43
    },
    "2021": {
      "count_in_nation": 1352,
      "count_in_state": 50,
      "percentile_in_nation": 0.4086,
      "percentile_in_state": 0.2653,
      "rank_in_nation": 800,
      "rank_in_state": 37
    },
    "2025": {
      "count_in_nation": 1100,
      "count_in_state": 46,
      "percentile_in_nation": 0.2038,
      "percentile_in_state": 0.2667,
      "rank_in_nation": 876,
      "rank_in_state": 34
    }
  },
  "revenue": {
    "1983": {
      "marketing_year": "1983",
      "price": 7.8,
      "revenue_per_harvested_acre": 202.8,
      "revenue_per_planted_acre": 202.8,
      "yield": 26.0
    },
    "1984": {
      "marketing_year": "1984",
      "price": 5.85,
      "revenue_per_harvested_acre": 175.5,
      "revenue_per_planted_acre": 175.5,
      "yield": 30.0
    },
    "1985": {
      "marketing_year": "1985",
      "price": 4.75,
      "revenue_per_harvested_acre": 137.75,
      "revenue_per_planted_acre": 137.75,
      "yield": 29.0
    },
    "1986": {
      "marketing_year": "1986",
      "price": 4.85,
      "revenue_per_harvested_acre": 145.5,
      "revenue_per_planted_acre": 145.5,
      "yield": 30.0
    },
    "1987": {
      "marketing_year": "1987",
      "price": 6.2,
      "revenue_per_harvested_acre": 204.6,
      "revenue_per_planted_acre": 204.6,
      "yield": 33.0
    },
    "1988": {
      "marketing_year": "1988",
      "price": 7.45,
      "revenue_per_harvested_acre": 223.5,
      "revenue_per_planted_acre": 223.5,
      "yield": 30.0
    },
    "1989": {
      "marketing_year": "1989",
      "price": 5.65,
      "revenue_per_harvested_acre": 169.5,
      "revenue_per_planted_acre": 169.5,
      "yield": 30.0
    },
    "1990": {
      "marketing_year": "1990",
      "price": 5.7,
      "revenue_per_harvested_acre": 182.4,
      "revenue_per_planted_acre": 182.4,
      "yield": 32.0
    },
    "2002": {
      "marketing_year": "2002",
      "price": 5.9,
      "revenue_per_harvested_acre": 118.0,
      "revenue_per_planted_acre": 118.0,
      "yield": 20.0
    },
    "2003": {
      "marketing_year": "2003",
      "price": 7.33,
      "revenue_per_harvested_acre": 307.86,
      "revenue_per_planted_acre": 307.86,
      "yield": 42.0
    },
    "2004": {
      "marketing_year": "2004",
      "price": 5.43,
      "revenue_per_harvested_acre": 200.91,
      "revenue_per_planted_acre": 200.91,
      "yield": 37.0
    },
    "2021": {
      "marketing_year": "2021",
      "price": 13.8,
      "revenue_per_harvested_acre": 656.88,
      "revenue_per_planted_acre": 646.3,
      "yield": 47.6
    },
    "2025": {
      "marketing_year": "2025",
      "price": 10.9,
      "revenue_per_harvested_acre": 405.48,
      "revenue_per_planted_acre": 337.9,
      "yield": 37.2
    }
  },
  "schema_version": 3,
  "state": {
    "alpha": "PA",
    "fips": "42",
    "name": "PENNSYLVANIA"
  },
  "yield_trend": {
    "slope_bu_per_year": 0.3175,
    "trailing_10yr_avg": {
      "1987": 29.6,
      "1988": 29.67,
      "1989": 29.71,
      "1990": 30.0
    },
    "trailing_5yr_avg": {
      "1985": 28.33,
      "1986": 28.75,
      "1987": 29.6,
      "1988": 30.4,
      "1989": 30.4,
      "1990": 31.0,
      "2004": 33.0
    },
    "yoy_pct": {
      "1984": 15.38,
      "1985": -3.33,
      "1986": 3.45,
      "1987": 10.0,
      "1988": -9.09,
      "1989": 0.0,
      "1990": 6.67,
      "2003": 110.0,
      "2004": -11.9
    }
  }
}
