{
  "commodity": {
    "desc": "CORN",
    "slug": "corn"
  },
  "county": {
    "code": "037",
    "name": "GOLDEN VALLEY"
  },
  "rank": {
    "1944": {
      "count_in_nation": 1444,
      "count_in_state": 36,
      "percentile_in_nation": 0.0,
      "percentile_in_state": 0.0,
      "rank_in_nation": 1444,
      "rank_in_state": 36
    },
    "1945": {
      "count_in_nation": 1447,
      "count_in_state": 38,
      "percentile_in_nation": 0.047,
      "percentile_in_state": 0.5135,
      "rank_in_nation": 1379,
      "rank_in_state": 19
    },
    "1946": {
      "count_in_nation": 1446,
      "count_in_state": 38,
      "percentile_in_nation": 0.1273,
      "percentile_in_state": 0.7838,
      "rank_in_nation": 1262,
      "rank_in_state": 9
    },
    "1947": {
      "count_in_nation": 1449,
      "count_in_state": 43,
      "percentile_in_nation": 0.3039,
      "percentile_in_state": 0.7381,
      "rank_in_nation": 1009,
      "rank_in_state": 12
    },
    "1948": {
      "count_in_nation": 1442,
      "count_in_state": 39,
      "percentile_in_nation": 0.3185,
      "percentile_in_state": 0.9474,
      "rank_in_nation": 983,
      "rank_in_state": 3
    },
    "1949": {
      "count_in_nation": 1376,
      "count_in_state": 37,
      "percentile_in_nation": 0.0276,
      "percentile_in_state": 0.4722,
      "rank_in_nation": 1338,
      "rank_in_state": 20
    },
    "1950": {
      "count_in_nation": 1416,
      "count_in_state": 35,
      "percentile_in_nation": 0.135,
      "percentile_in_state": 0.6176,
      "rank_in_nation": 1225,
      "rank_in_state": 14
    },
    "1951": {
      "count_in_nation": 1494,
      "count_in_state": 35,
      "percentile_in_nation": 0.0328,
      "percentile_in_state": 0.2353,
      "rank_in_nation": 1445,
      "rank_in_state": 27
    },
    "1952": {
      "count_in_nation": 1493,
      "count_in_state": 34,
      "percentile_in_nation": 0.0798,
      "percentile_in_state": 0.3636,
      "rank_in_nation": 1374,
      "rank_in_state": 22
    },
    "1953": {
      "count_in_nation": 1596,
      "count_in_state": 35,
      "percentile_in_nation": 0.0658,
      "percentile_in_state": 0.0294,
      "rank_in_nation": 1491,
      "rank_in_state": 34
    },
    "1954": {
      "count_in_nation": 1756,
      "count_in_state": 37,
      "percentile_in_nation": 0.1436,
      "percentile_in_state": 0.1667,
      "rank_in_nation": 1504,
      "rank_in_state": 31
    },
    "1955": {
      "count_in_nation": 1864,
      "count_in_state": 39,
      "percentile_in_nation": 0.029,
      "percentile_in_state": 0.0,
      "rank_in_nation": 1810,
      "rank_in_state": 39
    },
    "1957": {
      "count_in_nation": 1881,
      "count_in_state": 38,
      "percentile_in_nation": 0.367,
      "percentile_in_state": 0.6757,
      "rank_in_nation": 1191,
      "rank_in_state": 13
    },
    "1958": {
      "count_in_nation": 2058,
      "count_in_state": 38,
      "percentile_in_nation": 0.0316,
      "percentile_in_state": 0.4324,
      "rank_in_nation": 1993,
      "rank_in_state": 22
    },
    "1959": {
      "count_in_nation": 2173,
      "count_in_state": 40,
      "percentile_in_nation": 0.0235,
      "percentile_in_state": 0.1026,
      "rank_in_nation": 2122,
      "rank_in_state": 36
    },
    "1963": {
      "count_in_nation": 2353,
      "count_in_state": 22,
      "percentile_in_nation": 0.0298,
      "percentile_in_state": 0.1905,
      "rank_in_nation": 2283,
      "rank_in_state": 18
    },
    "1983": {
      "count_in_nation": 2355,
      "count_in_state": 19,
      "percentile_in_nation": 0.7766,
      "percentile_in_state": 0.1111,
      "rank_in_nation": 527,
      "rank_in_state": 17
    }
  },
  "revenue": {
    "1944": {
      "marketing_year": "1944",
      "price": 1.13,
      "revenue_per_harvested_acre": 9.04,
      "revenue_per_planted_acre": 7.91,
      "yield": 8.0
    },
    "1945": {
      "marketing_year": "1945",
      "price": 1.26,
      "revenue_per_harvested_acre": 16.38,
      "revenue_per_planted_acre": 15.876,
      "yield": 13.0
    },
    "1946": {
      "marketing_year": "1946",
      "price": 1.5,
      "revenue_per_harvested_acre": 25.5,
      "revenue_per_planted_acre": 25.0,
      "yield": 17.0
    },
    "1947": {
      "marketing_year": "1947",
      "price": 2.14,
      "revenue_per_harvested_acre": 44.94,
      "revenue_per_planted_acre": 44.94,
      "yield": 21.0
    },
    "1948": {
      "marketing_year": "1948",
      "price": 1.51,
      "revenue_per_harvested_acre": 46.81,
      "revenue_per_planted_acre": 46.81,
      "yield": 31.0
    },
    "1949": {
      "marketing_year": "1949",
      "price": 1.43,
      "revenue_per_harvested_acre": 14.3,
      "revenue_per_planted_acre": 14.3,
      "yield": 10.0
    },
    "1950": {
      "marketing_year": "1950",
      "price": 1.64,
      "revenue_per_harvested_acre": 32.8,
      "revenue_per_planted_acre": 32.8,
      "yield": 20.0
    },
    "1951": {
      "marketing_year": "1951",
      "price": 1.82,
      "revenue_per_harvested_acre": 21.84,
      "revenue_per_planted_acre": 21.84,
      "yield": 12.0
    },
    "1952": {
      "marketing_year": "1952",
      "price": 1.72,
      "revenue_per_harvested_acre": 20.64,
      "revenue_per_planted_acre": 20.64,
      "yield": 12.0
    },
    "1953": {
      "marketing_year": "1953",
      "price": 1.49,
      "revenue_per_harvested_acre": 22.35,
      "revenue_per_planted_acre": 14.9,
      "yield": 15.0
    },
    "1954": {
      "marketing_year": "1954",
      "price": 1.51,
      "revenue_per_harvested_acre": 16.61,
      "revenue_per_planted_acre": 15.855,
      "yield": 11.0
    },
    "1955": {
      "marketing_year": "1955",
      "price": 1.53,
      "revenue_per_harvested_acre": 18.36,
      "revenue_per_planted_acre": 17.85,
      "yield": 12.0
    },
    "1957": {
      "marketing_year": "1957",
      "price": 1.29,
      "revenue_per_harvested_acre": 38.7,
      "revenue_per_planted_acre": 38.3775,
      "yield": 30.0
    },
    "1958": {
      "marketing_year": "1958",
      "price": 1.16,
      "revenue_per_harvested_acre": 20.88,
      "revenue_per_planted_acre": 10.44,
      "yield": 18.0
    },
    "1959": {
      "marketing_year": "1959",
      "price": 1.26,
      "revenue_per_harvested_acre": 12.6,
      "revenue_per_planted_acre": 13.104,
      "yield": 10.0
    },
    "1963": {
      "marketing_year": "1963",
      "price": 1.2,
      "revenue_per_harvested_acre": 27.6,
      "revenue_per_planted_acre": 18.4,
      "yield": 23.0
    },
    "1983": {
      "marketing_year": "1983",
      "price": 3.2,
      "revenue_per_harvested_acre": 294.4,
      "revenue_per_planted_acre": 147.2,
      "yield": 92.0
    }
  },
  "schema_version": 3,
  "state": {
    "alpha": "MT",
    "fips": "30",
    "name": "MONTANA"
  },
  "yield_trend": {
    "slope_bu_per_year": 1.7033,
    "trailing_10yr_avg": {
      "1948": 18.0,
      "1949": 16.67,
      "1950": 17.14,
      "1951": 16.5,
      "1952": 16.0,
      "1953": 15.9,
      "1954": 16.2,
      "1955": 16.1,
      "1957": 17.0,
      "1958": 15.56,
      "1959": 15.56,
      "1963": 17.33
    },
    "trailing_5yr_avg": {
      "1946": 12.67,
      "1947": 14.75,
      "1948": 18.0,
      "1949": 18.4,
      "1950": 19.8,
      "1951": 18.8,
      "1952": 17.0,
      "1953": 13.8,
      "1954": 14.0,
      "1955": 12.4,
      "1957": 17.0,
      "1958": 17.75,
      "1959": 17.5
    },
    "yoy_pct": {
      "1945": 62.5,
      "1946": 30.77,
      "1947": 23.53,
      "1948": 47.62,
      "1949": -67.74,
      "1950": 100.0,
      "1951": -40.0,
      "1952": 0.0,
      "1953": 25.0,
      "1954": -26.67,
      "1955": 9.09,
      "1958": -40.0,
      "1959": -44.44
    }
  }
}
