{
  "commodity": {
    "desc": "SOYBEANS",
    "slug": "soybeans"
  },
  "county": {
    "code": "455",
    "name": "TRINITY"
  },
  "rank": {
    "1973": {
      "count_in_nation": 1761,
      "count_in_state": 42,
      "percentile_in_nation": 0.0102,
      "percentile_in_state": 0.1951,
      "rank_in_nation": 1743,
      "rank_in_state": 34
    },
    "1975": {
      "count_in_nation": 1792,
      "count_in_state": 56,
      "percentile_in_nation": 0.8543,
      "percentile_in_state": 0.9636,
      "rank_in_nation": 262,
      "rank_in_state": 3
    }
  },
  "revenue": {
    "1973": {
      "marketing_year": "1973",
      "price": 5.23,
      "revenue_per_harvested_acre": 80.019,
      "revenue_per_planted_acre": 78.45,
      "yield": 15.3
    },
    "1975": {
      "marketing_year": "1975",
      "price": 4.31,
      "revenue_per_harvested_acre": 137.058,
      "revenue_per_planted_acre": 123.266,
      "yield": 31.8
    }
  },
  "schema_version": 3,
  "state": {
    "alpha": "TX",
    "fips": "48",
    "name": "TEXAS"
  },
  "yield_trend": {
    "slope_bu_per_year": 8.25,
    "trailing_10yr_avg": {},
    "trailing_5yr_avg": {},
    "yoy_pct": {}
  }
}
