{
  "commodity": {
    "desc": "WHEAT",
    "slug": "wheat"
  },
  "county": {
    "code": "195",
    "name": "WORTH"
  },
  "rank": {
    "1974": {
      "count_in_nation": 2572,
      "count_in_state": 83,
      "percentile_in_nation": 0.4699,
      "percentile_in_state": 0.3659,
      "rank_in_nation": 1364,
      "rank_in_state": 53
    },
    "1975": {
      "count_in_nation": 2526,
      "count_in_state": 87,
      "percentile_in_nation": 0.882,
      "percentile_in_state": 0.8256,
      "rank_in_nation": 299,
      "rank_in_state": 16
    },
    "1976": {
      "count_in_nation": 2543,
      "count_in_state": 92,
      "percentile_in_nation": 0.8729,
      "percentile_in_state": 0.8571,
      "rank_in_nation": 324,
      "rank_in_state": 14
    },
    "1977": {
      "count_in_nation": 2482,
      "count_in_state": 77,
      "percentile_in_nation": 0.655,
      "percentile_in_state": 0.4868,
      "rank_in_nation": 857,
      "rank_in_state": 40
    }
  },
  "revenue": {
    "1974": {
      "marketing_year": "1974",
      "price": 4.13,
      "revenue_per_harvested_acre": 116.879,
      "revenue_per_planted_acre": 107.4887,
      "yield": 28.3
    },
    "1975": {
      "marketing_year": "1975",
      "price": 3.46,
      "revenue_per_harvested_acre": 139.784,
      "revenue_per_planted_acre": 127.5875,
      "yield": 40.4
    },
    "1976": {
      "marketing_year": "1976",
      "price": 2.94,
      "revenue_per_harvested_acre": 120.246,
      "revenue_per_planted_acre": 115.6909,
      "yield": 40.9
    },
    "1977": {
      "marketing_year": "1977",
      "price": 2.11,
      "revenue_per_harvested_acre": 75.327,
      "revenue_per_planted_acre": 63.9394,
      "yield": 35.7
    }
  },
  "schema_version": 3,
  "state": {
    "alpha": "IA",
    "fips": "19",
    "name": "IOWA"
  },
  "yield_trend": {
    "slope_bu_per_year": 2.27,
    "trailing_10yr_avg": {},
    "trailing_5yr_avg": {
      "1976": 36.53,
      "1977": 36.33
    },
    "yoy_pct": {
      "1975": 42.76,
      "1976": 1.24,
      "1977": -12.71
    }
  }
}
