{
  "commodity": {
    "desc": "WHEAT",
    "slug": "wheat"
  },
  "county": {
    "code": "101",
    "name": "NEWTON"
  },
  "rank": {
    "1957": {
      "count_in_nation": 1846,
      "count_in_state": 71,
      "percentile_in_nation": 0.3301,
      "percentile_in_state": 0.6429,
      "rank_in_nation": 1237,
      "rank_in_state": 26
    },
    "1958": {
      "count_in_nation": 1841,
      "count_in_state": 69,
      "percentile_in_nation": 0.0223,
      "percentile_in_state": 0.3676,
      "rank_in_nation": 1800,
      "rank_in_state": 44
    },
    "1959": {
      "count_in_nation": 1843,
      "count_in_state": 63,
      "percentile_in_nation": 0.7009,
      "percentile_in_state": 0.7258,
      "rank_in_nation": 552,
      "rank_in_state": 18
    },
    "1960": {
      "count_in_nation": 1841,
      "count_in_state": 67,
      "percentile_in_nation": 0.1799,
      "percentile_in_state": 0.4091,
      "rank_in_nation": 1510,
      "rank_in_state": 40
    },
    "1961": {
      "count_in_nation": 1931,
      "count_in_state": 63,
      "percentile_in_nation": 0.4487,
      "percentile_in_state": 0.6613,
      "rank_in_nation": 1065,
      "rank_in_state": 22
    },
    "1962": {
      "count_in_nation": 1760,
      "count_in_state": 59,
      "percentile_in_nation": 0.137,
      "percentile_in_state": 0.1724,
      "rank_in_nation": 1519,
      "rank_in_state": 49
    },
    "1963": {
      "count_in_nation": 1920,
      "count_in_state": 67,
      "percentile_in_nation": 0.1933,
      "percentile_in_state": 0.2121,
      "rank_in_nation": 1549,
      "rank_in_state": 53
    },
    "1964": {
      "count_in_nation": 1774,
      "count_in_state": 61,
      "percentile_in_nation": 0.1162,
      "percentile_in_state": 0.1167,
      "rank_in_nation": 1568,
      "rank_in_state": 54
    },
    "1965": {
      "count_in_nation": 1837,
      "count_in_state": 62,
      "percentile_in_nation": 0.274,
      "percentile_in_state": 0.0656,
      "rank_in_nation": 1334,
      "rank_in_state": 58
    },
    "1966": {
      "count_in_nation": 1889,
      "count_in_state": 75,
      "percentile_in_nation": 0.4873,
      "percentile_in_state": 0.2838,
      "rank_in_nation": 969,
      "rank_in_state": 54
    },
    "1981": {
      "count_in_nation": 2535,
      "count_in_state": 77,
      "percentile_in_nation": 0.4325,
      "percentile_in_state": 0.1316,
      "rank_in_nation": 1439,
      "rank_in_state": 67
    },
    "1982": {
      "count_in_nation": 2532,
      "count_in_state": 82,
      "percentile_in_nation": 0.5851,
      "percentile_in_state": 0.5802,
      "rank_in_nation": 1051,
      "rank_in_state": 35
    },
    "1983": {
      "count_in_nation": 2480,
      "count_in_state": 77,
      "percentile_in_nation": 0.2239,
      "percentile_in_state": 0.3816,
      "rank_in_nation": 1925,
      "rank_in_state": 48
    },
    "1984": {
      "count_in_nation": 2472,
      "count_in_state": 82,
      "percentile_in_nation": 0.2865,
      "percentile_in_state": 0.1852,
      "rank_in_nation": 1764,
      "rank_in_state": 67
    },
    "1985": {
      "count_in_nation": 2477,
      "count_in_state": 82,
      "percentile_in_nation": 0.3611,
      "percentile_in_state": 0.8395,
      "rank_in_nation": 1583,
      "rank_in_state": 14
    },
    "1986": {
      "count_in_nation": 2402,
      "count_in_state": 60,
      "percentile_in_nation": 0.4619,
      "percentile_in_state": 0.7119,
      "rank_in_nation": 1293,
      "rank_in_state": 18
    }
  },
  "revenue": {
    "1957": {
      "marketing_year": "1957",
      "price": 1.75,
      "revenue_per_harvested_acre": 31.5,
      "yield": 18.0
    },
    "1958": {
      "marketing_year": "1958",
      "price": 1.79,
      "revenue_per_harvested_acre": 25.06,
      "yield": 14.0
    },
    "1959": {
      "marketing_year": "1959",
      "price": 1.78,
      "revenue_per_harvested_acre": 44.5,
      "yield": 25.0
    },
    "1960": {
      "marketing_year": "1960",
      "price": 1.71,
      "revenue_per_harvested_acre": 34.2,
      "yield": 20.0
    },
    "1961": {
      "marketing_year": "1961",
      "price": 1.73,
      "revenue_per_harvested_acre": 43.25,
      "yield": 25.0
    },
    "1962": {
      "marketing_year": "1962",
      "price": 1.98,
      "revenue_per_harvested_acre": 35.64,
      "yield": 18.0
    },
    "1963": {
      "marketing_year": "1963",
      "price": 1.76,
      "revenue_per_harvested_acre": 35.2,
      "yield": 20.0
    },
    "1964": {
      "marketing_year": "1964",
      "price": 1.31,
      "revenue_per_harvested_acre": 23.58,
      "yield": 18.0
    },
    "1965": {
      "marketing_year": "1965",
      "price": 1.29,
      "revenue_per_harvested_acre": 28.38,
      "yield": 22.0
    },
    "1966": {
      "marketing_year": "1966",
      "price": 1.58,
      "revenue_per_harvested_acre": 44.24,
      "yield": 28.0
    },
    "1981": {
      "marketing_year": "1981",
      "price": 3.25,
      "revenue_per_harvested_acre": 118.3,
      "revenue_per_planted_acre": 85.9773,
      "yield": 36.4
    },
    "1982": {
      "marketing_year": "1982",
      "price": 3.0,
      "revenue_per_harvested_acre": 108.0,
      "revenue_per_planted_acre": 46.2857,
      "yield": 36.0
    },
    "1983": {
      "marketing_year": "1983",
      "price": 3.6,
      "revenue_per_harvested_acre": 109.08,
      "revenue_per_planted_acre": 78.8,
      "yield": 30.3
    },
    "1984": {
      "marketing_year": "1984",
      "price": 3.4,
      "revenue_per_harvested_acre": 115.6,
      "revenue_per_planted_acre": 86.7,
      "yield": 34.0
    },
    "1985": {
      "marketing_year": "1985",
      "price": 3.3,
      "revenue_per_harvested_acre": 105.6,
      "revenue_per_planted_acre": 84.48,
      "yield": 32.0
    },
    "1986": {
      "marketing_year": "1986",
      "price": 2.8,
      "revenue_per_harvested_acre": 89.6,
      "revenue_per_planted_acre": 59.7333,
      "yield": 32.0
    }
  },
  "schema_version": 3,
  "state": {
    "alpha": "MS",
    "fips": "28",
    "name": "MISSISSIPPI"
  },
  "yield_trend": {
    "slope_bu_per_year": 0.5642,
    "trailing_10yr_avg": {
      "1961": 20.4,
      "1962": 20.0,
      "1963": 20.0,
      "1964": 19.75,
      "1965": 20.0,
      "1966": 20.8,
      "1985": 33.74,
      "1986": 33.45
    },
    "trailing_5yr_avg": {
      "1959": 19.0,
      "1960": 19.25,
      "1961": 20.4,
      "1962": 20.4,
      "1963": 21.6,
      "1964": 20.2,
      "1965": 20.6,
      "1966": 21.2,
      "1983": 34.23,
      "1984": 34.17,
      "1985": 33.74,
      "1986": 32.86
    },
    "yoy_pct": {
      "1958": -22.22,
      "1959": 78.57,
      "1960": -20.0,
      "1961": 25.0,
      "1962": -28.0,
      "1963": 11.11,
      "1964": -10.0,
      "1965": 22.22,
      "1966": 27.27,
      "1982": -1.1,
      "1983": -15.83,
      "1984": 12.21,
      "1985": -5.88,
      "1986": 0.0
    }
  }
}
