{
  "commodity": {
    "desc": "SOYBEANS",
    "slug": "soybeans"
  },
  "county": {
    "code": "477",
    "name": "WASHINGTON"
  },
  "rank": {
    "1973": {
      "count_in_nation": 1761,
      "count_in_state": 42,
      "percentile_in_nation": 0.1028,
      "percentile_in_state": 0.4878,
      "rank_in_nation": 1580,
      "rank_in_state": 22
    }
  },
  "revenue": {
    "1973": {
      "marketing_year": "1973",
      "price": 5.23,
      "revenue_per_harvested_acre": 97.801,
      "revenue_per_planted_acre": 81.3556,
      "yield": 18.7
    }
  },
  "schema_version": 3,
  "state": {
    "alpha": "TX",
    "fips": "48",
    "name": "TEXAS"
  },
  "yield_trend": {
    "trailing_10yr_avg": {},
    "trailing_5yr_avg": {},
    "yoy_pct": {}
  }
}
