{
  "commodity": {
    "desc": "WHEAT",
    "slug": "wheat"
  },
  "county": {
    "code": "111",
    "name": "MCDOWELL"
  },
  "rank": {
    "1972": {
      "count_in_nation": 2503,
      "count_in_state": 85,
      "percentile_in_nation": 0.452,
      "percentile_in_state": 0.5119,
      "rank_in_nation": 1372,
      "rank_in_state": 42
    },
    "1973": {
      "count_in_nation": 2517,
      "count_in_state": 85,
      "percentile_in_nation": 0.7619,
      "percentile_in_state": 0.6429,
      "rank_in_nation": 600,
      "rank_in_state": 31
    },
    "1974": {
      "count_in_nation": 2572,
      "count_in_state": 84,
      "percentile_in_nation": 0.1692,
      "percentile_in_state": 0.0,
      "rank_in_nation": 2137,
      "rank_in_state": 84
    },
    "1975": {
      "count_in_nation": 2526,
      "count_in_state": 84,
      "percentile_in_nation": 0.2198,
      "percentile_in_state": 0.0241,
      "rank_in_nation": 1971,
      "rank_in_state": 82
    },
    "1976": {
      "count_in_nation": 2543,
      "count_in_state": 83,
      "percentile_in_nation": 0.4811,
      "percentile_in_state": 0.6707,
      "rank_in_nation": 1320,
      "rank_in_state": 28
    },
    "1977": {
      "count_in_nation": 2482,
      "count_in_state": 83,
      "percentile_in_nation": 0.4946,
      "percentile_in_state": 0.6707,
      "rank_in_nation": 1255,
      "rank_in_state": 28
    },
    "1978": {
      "count_in_nation": 2420,
      "count_in_state": 80,
      "percentile_in_nation": 0.1236,
      "percentile_in_state": 0.0,
      "rank_in_nation": 2121,
      "rank_in_state": 80
    },
    "1979": {
      "count_in_nation": 2448,
      "count_in_state": 80,
      "percentile_in_nation": 0.0503,
      "percentile_in_state": 0.0,
      "rank_in_nation": 2325,
      "rank_in_state": 80
    },
    "1980": {
      "count_in_nation": 2503,
      "count_in_state": 84,
      "percentile_in_nation": 0.2998,
      "percentile_in_state": 0.1566,
      "rank_in_nation": 1753,
      "rank_in_state": 71
    },
    "1983": {
      "count_in_nation": 2480,
      "count_in_state": 86,
      "percentile_in_nation": 0.4474,
      "percentile_in_state": 0.6588,
      "rank_in_nation": 1371,
      "rank_in_state": 30
    },
    "1984": {
      "count_in_nation": 2472,
      "count_in_state": 87,
      "percentile_in_nation": 0.5933,
      "percentile_in_state": 0.314,
      "rank_in_nation": 1006,
      "rank_in_state": 60
    },
    "1991": {
      "count_in_nation": 2236,
      "count_in_state": 83,
      "percentile_in_nation": 0.6573,
      "percentile_in_state": 0.4268,
      "rank_in_nation": 767,
      "rank_in_state": 48
    },
    "1995": {
      "count_in_nation": 1959,
      "count_in_state": 82,
      "percentile_in_nation": 0.7186,
      "percentile_in_state": 0.8272,
      "rank_in_nation": 552,
      "rank_in_state": 15
    }
  },
  "revenue": {
    "1972": {
      "marketing_year": "1972",
      "price": 1.34,
      "revenue_per_harvested_acre": 40.2,
      "revenue_per_planted_acre": 32.16,
      "yield": 30.0
    },
    "1973": {
      "marketing_year": "1973",
      "price": 2.88,
      "revenue_per_harvested_acre": 100.8,
      "revenue_per_planted_acre": 79.5789,
      "yield": 35.0
    },
    "1974": {
      "marketing_year": "1974",
      "price": 3.29,
      "revenue_per_harvested_acre": 65.8,
      "revenue_per_planted_acre": 61.6875,
      "yield": 20.0
    },
    "1975": {
      "marketing_year": "1975",
      "price": 2.79,
      "revenue_per_harvested_acre": 66.96,
      "revenue_per_planted_acre": 59.52,
      "yield": 24.0
    },
    "1976": {
      "marketing_year": "1976",
      "price": 3.0,
      "revenue_per_harvested_acre": 90.0,
      "revenue_per_planted_acre": 81.0,
      "yield": 30.0
    },
    "1977": {
      "marketing_year": "1977",
      "price": 2.2,
      "revenue_per_harvested_acre": 70.4,
      "revenue_per_planted_acre": 66.0,
      "yield": 32.0
    },
    "1978": {
      "marketing_year": "1978",
      "price": 2.85,
      "revenue_per_harvested_acre": 65.55,
      "revenue_per_planted_acre": 57.3563,
      "yield": 23.0
    },
    "1979": {
      "marketing_year": "1979",
      "price": 3.7,
      "revenue_per_harvested_acre": 74.0,
      "revenue_per_planted_acre": 67.2727,
      "yield": 20.0
    },
    "1980": {
      "marketing_year": "1980",
      "price": 3.75,
      "revenue_per_harvested_acre": 112.5,
      "revenue_per_planted_acre": 105.4688,
      "yield": 30.0
    },
    "1983": {
      "marketing_year": "1983",
      "price": 3.05,
      "revenue_per_harvested_acre": 106.75,
      "revenue_per_planted_acre": 85.4,
      "yield": 35.0
    },
    "1984": {
      "marketing_year": "1984",
      "price": 3.35,
      "revenue_per_harvested_acre": 134.0,
      "revenue_per_planted_acre": 111.6667,
      "yield": 40.0
    },
    "1991": {
      "marketing_year": "1991",
      "price": 2.85,
      "revenue_per_harvested_acre": 105.45,
      "revenue_per_planted_acre": 89.5714,
      "yield": 37.0
    },
    "1995": {
      "marketing_year": "1995",
      "price": 3.65,
      "revenue_per_harvested_acre": 182.5,
      "revenue_per_planted_acre": 121.6667,
      "yield": 50.0
    }
  },
  "schema_version": 3,
  "state": {
    "alpha": "NC",
    "fips": "37",
    "name": "NORTH CAROLINA"
  },
  "yield_trend": {
    "slope_bu_per_year": 0.8857,
    "trailing_10yr_avg": {
      "1976": 27.8,
      "1977": 28.5,
      "1978": 27.71,
      "1979": 26.75,
      "1980": 27.11,
      "1983": 26.75,
      "1984": 29.25
    },
    "trailing_5yr_avg": {
      "1974": 28.33,
      "1975": 27.25,
      "1976": 27.8,
      "1977": 28.2,
      "1978": 25.8,
      "1979": 25.8,
      "1980": 27.0,
      "1983": 28.33,
      "1984": 35.0
    },
    "yoy_pct": {
      "1973": 16.67,
      "1974": -42.86,
      "1975": 20.0,
      "1976": 25.0,
      "1977": 6.67,
      "1978": -28.12,
      "1979": -13.04,
      "1980": 50.0,
      "1984": 14.29
    }
  }
}
