{
  "commodity": {
    "desc": "SOYBEANS",
    "slug": "soybeans"
  },
  "county": {
    "code": "179",
    "name": "LIBERTY"
  },
  "rank": {
    "1969": {
      "count_in_nation": 1471,
      "count_in_state": 116,
      "percentile_in_nation": 0.9224,
      "percentile_in_state": 1.0,
      "rank_in_nation": 115,
      "rank_in_state": 1
    },
    "1978": {
      "count_in_nation": 1857,
      "count_in_state": 140,
      "percentile_in_nation": 0.4795,
      "percentile_in_state": 0.9712,
      "rank_in_nation": 967,
      "rank_in_state": 5
    },
    "1979": {
      "count_in_nation": 1882,
      "count_in_state": 147,
      "percentile_in_nation": 0.3323,
      "percentile_in_state": 0.4452,
      "rank_in_nation": 1257,
      "rank_in_state": 82
    },
    "1980": {
      "count_in_nation": 1866,
      "count_in_state": 147,
      "percentile_in_nation": 0.4692,
      "percentile_in_state": 0.9315,
      "rank_in_nation": 991,
      "rank_in_state": 11
    },
    "1981": {
      "count_in_nation": 1835,
      "count_in_state": 147,
      "percentile_in_nation": 0.205,
      "percentile_in_state": 0.6301,
      "rank_in_nation": 1459,
      "rank_in_state": 55
    },
    "1982": {
      "count_in_nation": 1813,
      "count_in_state": 146,
      "percentile_in_nation": 0.3813,
      "percentile_in_state": 0.469,
      "rank_in_nation": 1122,
      "rank_in_state": 78
    },
    "1983": {
      "count_in_nation": 1870,
      "count_in_state": 142,
      "percentile_in_nation": 0.344,
      "percentile_in_state": 0.3262,
      "rank_in_nation": 1227,
      "rank_in_state": 96
    },
    "1984": {
      "count_in_nation": 1875,
      "count_in_state": 146,
      "percentile_in_nation": 0.4034,
      "percentile_in_state": 0.7379,
      "rank_in_nation": 1119,
      "rank_in_state": 39
    },
    "1985": {
      "count_in_nation": 1853,
      "count_in_state": 142,
      "percentile_in_nation": 0.1922,
      "percentile_in_state": 0.461,
      "rank_in_nation": 1497,
      "rank_in_state": 77
    },
    "1986": {
      "count_in_nation": 1814,
      "count_in_state": 131,
      "percentile_in_nation": 0.4032,
      "percentile_in_state": 0.9154,
      "rank_in_nation": 1083,
      "rank_in_state": 12
    },
    "1987": {
      "count_in_nation": 1778,
      "count_in_state": 127,
      "percentile_in_nation": 0.2386,
      "percentile_in_state": 0.6984,
      "rank_in_nation": 1354,
      "rank_in_state": 39
    },
    "1988": {
      "count_in_nation": 1814,
      "count_in_state": 128,
      "percentile_in_nation": 0.1451,
      "percentile_in_state": 0.2362,
      "rank_in_nation": 1551,
      "rank_in_state": 98
    },
    "1989": {
      "count_in_nation": 1825,
      "count_in_state": 129,
      "percentile_in_nation": 0.2401,
      "percentile_in_state": 0.3281,
      "rank_in_nation": 1387,
      "rank_in_state": 87
    },
    "1990": {
      "count_in_nation": 1773,
      "count_in_state": 122,
      "percentile_in_nation": 0.3177,
      "percentile_in_state": 0.8926,
      "rank_in_nation": 1210,
      "rank_in_state": 14
    },
    "1991": {
      "count_in_nation": 1740,
      "count_in_state": 128,
      "percentile_in_nation": 0.161,
      "percentile_in_state": 0.3386,
      "rank_in_nation": 1460,
      "rank_in_state": 85
    },
    "1992": {
      "count_in_nation": 1739,
      "count_in_state": 123,
      "percentile_in_nation": 0.3487,
      "percentile_in_state": 0.6557,
      "rank_in_nation": 1133,
      "rank_in_state": 43
    }
  },
  "revenue": {
    "1969": {
      "marketing_year": "1969",
      "price": 2.44,
      "revenue_per_harvested_acre": 85.4,
      "yield": 35.0
    },
    "1978": {
      "marketing_year": "1978",
      "price": 6.39,
      "revenue_per_harvested_acre": 159.75,
      "revenue_per_planted_acre": 153.36,
      "yield": 25.0
    },
    "1979": {
      "marketing_year": "1979",
      "price": 6.36,
      "revenue_per_harvested_acre": 165.996,
      "revenue_per_planted_acre": 153.1292,
      "yield": 26.1
    },
    "1980": {
      "marketing_year": "1980",
      "price": 7.63,
      "revenue_per_harvested_acre": 157.941,
      "revenue_per_planted_acre": 140.3072,
      "yield": 20.7
    },
    "1981": {
      "marketing_year": "1981",
      "price": 6.09,
      "revenue_per_harvested_acre": 129.108,
      "revenue_per_planted_acre": 115.275,
      "yield": 21.2
    },
    "1982": {
      "marketing_year": "1982",
      "price": 5.45,
      "revenue_per_harvested_acre": 145.515,
      "revenue_per_planted_acre": 145.3333,
      "yield": 26.7
    },
    "1983": {
      "marketing_year": "1983",
      "price": 7.59,
      "revenue_per_harvested_acre": 144.21,
      "revenue_per_planted_acre": 144.3825,
      "yield": 19.0
    },
    "1984": {
      "marketing_year": "1984",
      "price": 5.99,
      "revenue_per_harvested_acre": 148.552,
      "revenue_per_planted_acre": 148.3886,
      "yield": 24.8
    },
    "1985": {
      "marketing_year": "1985",
      "price": 4.82,
      "revenue_per_harvested_acre": 114.234,
      "revenue_per_planted_acre": 108.45,
      "yield": 23.7
    },
    "1986": {
      "marketing_year": "1986",
      "price": 4.75,
      "revenue_per_harvested_acre": 123.975,
      "revenue_per_planted_acre": 109.25,
      "yield": 26.1
    },
    "1987": {
      "marketing_year": "1987",
      "price": 5.61,
      "revenue_per_harvested_acre": 121.737,
      "revenue_per_planted_acre": 116.688,
      "yield": 21.7
    },
    "1988": {
      "marketing_year": "1988",
      "price": 7.3,
      "revenue_per_harvested_acre": 144.54,
      "revenue_per_planted_acre": 144.175,
      "yield": 19.8
    },
    "1989": {
      "marketing_year": "1989",
      "price": 5.61,
      "revenue_per_harvested_acre": 130.713,
      "revenue_per_planted_acre": 117.81,
      "yield": 23.3
    },
    "1990": {
      "marketing_year": "1990",
      "price": 5.74,
      "revenue_per_harvested_acre": 137.76,
      "revenue_per_planted_acre": 41.328,
      "yield": 24.0
    },
    "1991": {
      "marketing_year": "1991",
      "price": 5.53,
      "revenue_per_harvested_acre": 127.19,
      "revenue_per_planted_acre": 84.7933,
      "yield": 23.0
    },
    "1992": {
      "marketing_year": "1992",
      "price": 5.49,
      "revenue_per_harvested_acre": 164.7,
      "revenue_per_planted_acre": 164.7,
      "yield": 30.0
    }
  },
  "schema_version": 3,
  "state": {
    "alpha": "GA",
    "fips": "13",
    "name": "GEORGIA"
  },
  "yield_trend": {
    "slope_bu_per_year": -0.2742,
    "trailing_10yr_avg": {
      "1982": 23.94,
      "1983": 23.12,
      "1984": 23.36,
      "1985": 23.4,
      "1986": 23.7,
      "1987": 23.5,
      "1988": 22.98,
      "1989": 22.7,
      "1990": 23.03,
      "1991": 23.21,
      "1992": 23.54
    },
    "trailing_5yr_avg": {
      "1980": 23.93,
      "1981": 23.25,
      "1982": 23.94,
      "1983": 22.74,
      "1984": 22.48,
      "1985": 23.08,
      "1986": 24.06,
      "1987": 23.06,
      "1988": 23.22,
      "1989": 22.92,
      "1990": 22.98,
      "1991": 22.36,
      "1992": 24.02
    },
    "yoy_pct": {
      "1979": 4.4,
      "1980": -20.69,
      "1981": 2.42,
      "1982": 25.94,
      "1983": -28.84,
      "1984": 30.53,
      "1985": -4.44,
      "1986": 10.13,
      "1987": -16.86,
      "1988": -8.76,
      "1989": 17.68,
      "1990": 3.0,
      "1991": -4.17,
      "1992": 30.43
    }
  }
}
