{
  "commodity": {
    "desc": "WHEAT",
    "slug": "wheat"
  },
  "county": {
    "code": "003",
    "name": "ALLEGANY"
  },
  "rank": {
    "1972": {
      "count_in_nation": 2503,
      "count_in_state": 48,
      "percentile_in_nation": 0.6491,
      "percentile_in_state": 0.1064,
      "rank_in_nation": 879,
      "rank_in_state": 43
    },
    "1973": {
      "count_in_nation": 2517,
      "count_in_state": 49,
      "percentile_in_nation": 0.7619,
      "percentile_in_state": 0.2083,
      "rank_in_nation": 600,
      "rank_in_state": 39
    },
    "1974": {
      "count_in_nation": 2572,
      "count_in_state": 47,
      "percentile_in_nation": 0.8549,
      "percentile_in_state": 0.4348,
      "rank_in_nation": 374,
      "rank_in_state": 27
    },
    "1975": {
      "count_in_nation": 2526,
      "count_in_state": 44,
      "percentile_in_nation": 0.8218,
      "percentile_in_state": 0.5349,
      "rank_in_nation": 451,
      "rank_in_state": 21
    },
    "1976": {
      "count_in_nation": 2543,
      "count_in_state": 44,
      "percentile_in_nation": 0.7227,
      "percentile_in_state": 0.4651,
      "rank_in_nation": 706,
      "rank_in_state": 24
    },
    "1977": {
      "count_in_nation": 2482,
      "count_in_state": 41,
      "percentile_in_nation": 0.6372,
      "percentile_in_state": 0.3,
      "rank_in_nation": 901,
      "rank_in_state": 29
    },
    "1978": {
      "count_in_nation": 2420,
      "count_in_state": 31,
      "percentile_in_nation": 0.4254,
      "percentile_in_state": 0.0,
      "rank_in_nation": 1391,
      "rank_in_state": 31
    },
    "1979": {
      "count_in_nation": 2448,
      "count_in_state": 26,
      "percentile_in_nation": 0.5541,
      "percentile_in_state": 0.16,
      "rank_in_nation": 1092,
      "rank_in_state": 22
    },
    "1980": {
      "count_in_nation": 2503,
      "count_in_state": 26,
      "percentile_in_nation": 0.5719,
      "percentile_in_state": 0.28,
      "rank_in_nation": 1072,
      "rank_in_state": 19
    },
    "1981": {
      "count_in_nation": 2535,
      "count_in_state": 26,
      "percentile_in_nation": 0.5533,
      "percentile_in_state": 0.36,
      "rank_in_nation": 1133,
      "rank_in_state": 17
    },
    "1982": {
      "count_in_nation": 2532,
      "count_in_state": 27,
      "percentile_in_nation": 0.8657,
      "percentile_in_state": 0.8846,
      "rank_in_nation": 341,
      "rank_in_state": 4
    },
    "1983": {
      "count_in_nation": 2480,
      "count_in_state": 28,
      "percentile_in_nation": 0.9004,
      "percentile_in_state": 1.0,
      "rank_in_nation": 248,
      "rank_in_state": 1
    },
    "1984": {
      "count_in_nation": 2472,
      "count_in_state": 28,
      "percentile_in_nation": 0.159,
      "percentile_in_state": 0.0,
      "rank_in_nation": 2079,
      "rank_in_state": 28
    },
    "1985": {
      "count_in_nation": 2477,
      "count_in_state": 26,
      "percentile_in_nation": 0.7407,
      "percentile_in_state": 0.2,
      "rank_in_nation": 643,
      "rank_in_state": 21
    },
    "1986": {
      "count_in_nation": 2402,
      "count_in_state": 26,
      "percentile_in_nation": 0.7239,
      "percentile_in_state": 0.16,
      "rank_in_nation": 664,
      "rank_in_state": 22
    },
    "1987": {
      "count_in_nation": 2373,
      "count_in_state": 28,
      "percentile_in_nation": 0.5932,
      "percentile_in_state": 0.2963,
      "rank_in_nation": 966,
      "rank_in_state": 20
    },
    "1988": {
      "count_in_nation": 2362,
      "count_in_state": 28,
      "percentile_in_nation": 0.8801,
      "percentile_in_state": 0.7407,
      "rank_in_nation": 284,
      "rank_in_state": 8
    },
    "1989": {
      "count_in_nation": 2359,
      "count_in_state": 28,
      "percentile_in_nation": 0.3698,
      "percentile_in_state": 0.0741,
      "rank_in_nation": 1487,
      "rank_in_state": 26
    },
    "1990": {
      "count_in_nation": 2329,
      "count_in_state": 27,
      "percentile_in_nation": 0.6628,
      "percentile_in_state": 0.4615,
      "rank_in_nation": 786,
      "rank_in_state": 15
    },
    "1999": {
      "count_in_nation": 1856,
      "count_in_state": 31,
      "percentile_in_nation": 0.7736,
      "percentile_in_state": 0.1667,
      "rank_in_nation": 421,
      "rank_in_state": 26
    },
    "2000": {
      "count_in_nation": 1833,
      "count_in_state": 32,
      "percentile_in_nation": 0.5033,
      "percentile_in_state": 0.2903,
      "rank_in_nation": 911,
      "rank_in_state": 23
    },
    "2002": {
      "count_in_nation": 1782,
      "count_in_state": 26,
      "percentile_in_nation": 0.8186,
      "percentile_in_state": 0.64,
      "rank_in_nation": 324,
      "rank_in_state": 10
    }
  },
  "revenue": {
    "1972": {
      "marketing_year": "1972",
      "price": 1.55,
      "revenue_per_harvested_acre": 54.25,
      "revenue_per_planted_acre": 47.4688,
      "yield": 35.0
    },
    "1973": {
      "marketing_year": "1973",
      "price": 3.77,
      "revenue_per_harvested_acre": 131.95,
      "revenue_per_planted_acre": 118.755,
      "yield": 35.0
    },
    "1974": {
      "marketing_year": "1974",
      "price": 3.71,
      "revenue_per_harvested_acre": 144.69,
      "revenue_per_planted_acre": 134.355,
      "yield": 39.0
    },
    "1975": {
      "marketing_year": "1975",
      "price": 2.96,
      "revenue_per_harvested_acre": 109.52,
      "revenue_per_planted_acre": 99.5636,
      "yield": 37.0
    },
    "1976": {
      "marketing_year": "1976",
      "price": 2.67,
      "revenue_per_harvested_acre": 93.45,
      "revenue_per_planted_acre": 85.6625,
      "yield": 35.0
    },
    "1977": {
      "marketing_year": "1977",
      "price": 1.96,
      "revenue_per_harvested_acre": 68.6,
      "revenue_per_planted_acre": 68.6,
      "yield": 35.0
    },
    "1978": {
      "marketing_year": "1978",
      "price": 3.35,
      "revenue_per_harvested_acre": 100.5,
      "revenue_per_planted_acre": 100.5,
      "yield": 30.0
    },
    "1979": {
      "marketing_year": "1979",
      "price": 3.77,
      "revenue_per_harvested_acre": 131.95,
      "revenue_per_planted_acre": 131.95,
      "yield": 35.0
    },
    "1980": {
      "marketing_year": "1980",
      "price": 3.95,
      "revenue_per_harvested_acre": 142.2,
      "revenue_per_planted_acre": 142.2,
      "yield": 36.0
    },
    "1981": {
      "marketing_year": "1981",
      "price": 3.2,
      "revenue_per_harvested_acre": 124.8,
      "revenue_per_planted_acre": 124.8,
      "yield": 39.0
    },
    "1982": {
      "marketing_year": "1982",
      "price": 3.3,
      "revenue_per_harvested_acre": 145.2,
      "revenue_per_planted_acre": 108.9,
      "yield": 44.0
    },
    "1983": {
      "marketing_year": "1983",
      "price": 3.3,
      "revenue_per_harvested_acre": 174.9,
      "revenue_per_planted_acre": 139.92,
      "yield": 53.0
    },
    "1984": {
      "marketing_year": "1984",
      "price": 3.25,
      "revenue_per_harvested_acre": 97.5,
      "revenue_per_planted_acre": 97.5,
      "yield": 30.0
    },
    "1985": {
      "marketing_year": "1985",
      "price": 2.8,
      "revenue_per_harvested_acre": 128.8,
      "revenue_per_planted_acre": 128.8,
      "yield": 46.0
    },
    "1986": {
      "marketing_year": "1986",
      "price": 2.25,
      "revenue_per_harvested_acre": 90.0,
      "revenue_per_planted_acre": 77.1429,
      "yield": 40.0
    },
    "1987": {
      "marketing_year": "1987",
      "price": 2.6,
      "revenue_per_harvested_acre": 106.6,
      "revenue_per_planted_acre": 53.3,
      "yield": 41.0
    },
    "1988": {
      "marketing_year": "1988",
      "price": 3.5,
      "revenue_per_harvested_acre": 196.0,
      "revenue_per_planted_acre": 196.0,
      "yield": 56.0
    },
    "1989": {
      "marketing_year": "1989",
      "price": 3.5,
      "revenue_per_harvested_acre": 112.0,
      "revenue_per_planted_acre": 84.0,
      "yield": 32.0
    },
    "1990": {
      "marketing_year": "1990",
      "price": 2.7,
      "revenue_per_harvested_acre": 116.1,
      "revenue_per_planted_acre": 77.4,
      "yield": 43.0
    },
    "1999": {
      "marketing_year": "1999",
      "price": 2.05,
      "revenue_per_harvested_acre": 120.95,
      "revenue_per_planted_acre": 121.6333,
      "yield": 59.0
    },
    "2000": {
      "marketing_year": "2000",
      "price": 1.94,
      "revenue_per_harvested_acre": 93.12,
      "revenue_per_planted_acre": 92.635,
      "yield": 48.0
    },
    "2002": {
      "marketing_year": "2002",
      "price": 3.28,
      "revenue_per_harvested_acre": 190.24,
      "revenue_per_planted_acre": 189.584,
      "yield": 58.0
    }
  },
  "schema_version": 3,
  "state": {
    "alpha": "NY",
    "fips": "36",
    "name": "NEW YORK"
  },
  "yield_trend": {
    "slope_bu_per_year": 0.7177,
    "trailing_10yr_avg": {
      "1976": 36.2,
      "1977": 36.0,
      "1978": 35.14,
      "1979": 35.12,
      "1980": 35.22,
      "1981": 35.6,
      "1982": 36.5,
      "1983": 38.3,
      "1984": 37.4,
      "1985": 38.3,
      "1986": 38.8,
      "1987": 39.4,
      "1988": 42.0,
      "1989": 41.7,
      "1990": 42.4
    },
    "trailing_5yr_avg": {
      "1974": 36.33,
      "1975": 36.5,
      "1976": 36.2,
      "1977": 36.2,
      "1978": 35.2,
      "1979": 34.4,
      "1980": 34.2,
      "1981": 35.0,
      "1982": 36.8,
      "1983": 41.4,
      "1984": 40.4,
      "1985": 42.4,
      "1986": 42.6,
      "1987": 42.0,
      "1988": 42.6,
      "1989": 43.0,
      "1990": 42.4,
      "2002": 55.0
    },
    "yoy_pct": {
      "1973": 0.0,
      "1974": 11.43,
      "1975": -5.13,
      "1976": -5.41,
      "1977": 0.0,
      "1978": -14.29,
      "1979": 16.67,
      "1980": 2.86,
      "1981": 8.33,
      "1982": 12.82,
      "1983": 20.45,
      "1984": -43.4,
      "1985": 53.33,
      "1986": -13.04,
      "1987": 2.5,
      "1988": 36.59,
      "1989": -42.86,
      "1990": 34.38,
      "2000": -18.64
    }
  }
}
