{
  "commodity": {
    "desc": "WHEAT",
    "slug": "wheat"
  },
  "county": {
    "code": "465",
    "name": "VAL VERDE"
  },
  "rank": {
    "1968": {
      "count_in_nation": 2089,
      "count_in_state": 168,
      "percentile_in_nation": 0.568,
      "percentile_in_state": 0.9461,
      "rank_in_nation": 903,
      "rank_in_state": 10
    }
  },
  "revenue": {
    "1968": {
      "marketing_year": "1968",
      "price": 1.26,
      "revenue_per_harvested_acre": 38.178,
      "revenue_per_planted_acre": 16.6174,
      "yield": 30.3
    }
  },
  "schema_version": 3,
  "state": {
    "alpha": "TX",
    "fips": "48",
    "name": "TEXAS"
  },
  "yield_trend": {
    "trailing_10yr_avg": {},
    "trailing_5yr_avg": {},
    "yoy_pct": {}
  }
}
